{
  "$schema": "../../schema/case.schema.json",
  "name": "requests-that-are-not-calls",
  "description": "An unparseable body, an incomplete body, an unknown path and the Batches route get their responses, take no step and are not logged.",
  "scenario": {
    "name": "one-step",
    "steps": [
      {
        "text": "only"
      }
    ]
  },
  "exchanges": [
    {
      "request": {
        "method": "POST",
        "path": "/anthropic/v1/messages",
        "headers": {
          "content-type": "application/json"
        },
        "rawBody": "{\"model\":"
      },
      "response": {
        "status": 400,
        "headers": {
          "content-type": "application/json"
        },
        "body": {
          "fake_llm_error": "exception",
          "detail": {
            "$type": "string"
          }
        }
      }
    },
    {
      "request": {
        "method": "POST",
        "path": "/anthropic/v1/messages",
        "headers": {
          "content-type": "application/json"
        },
        "body": {
          "model": "example-model"
        }
      },
      "response": {
        "status": 400,
        "headers": {
          "content-type": "application/json"
        },
        "body": {
          "fake_llm_error": "exception",
          "detail": {
            "$type": "string"
          }
        }
      }
    },
    {
      "request": {
        "method": "POST",
        "path": "/nope",
        "headers": {
          "content-type": "application/json"
        },
        "body": {}
      },
      "response": {
        "status": 404,
        "headers": {
          "content-type": "application/json"
        },
        "body": {
          "fake_llm_error": {
            "$type": "string"
          }
        }
      }
    },
    {
      "request": {
        "method": "POST",
        "path": "/anthropic/v1/messages/batches",
        "headers": {
          "content-type": "application/json"
        },
        "body": {}
      },
      "response": {
        "status": 501,
        "headers": {
          "content-type": "application/json"
        },
        "body": {
          "fake_llm_error": {
            "$type": "string"
          }
        }
      }
    },
    {
      "request": {
        "method": "GET",
        "path": "/control/calls"
      },
      "response": {
        "status": 200,
        "headers": {
          "content-type": "application/json"
        },
        "body": []
      }
    },
    {
      "request": {
        "method": "POST",
        "path": "/anthropic/v1/messages",
        "headers": {
          "content-type": "application/json"
        },
        "body": {
          "model": "example-model",
          "max_tokens": 64,
          "messages": [
            {
              "role": "user",
              "content": "Hello"
            }
          ]
        }
      },
      "response": {
        "status": 200,
        "headers": {
          "content-type": "application/json"
        },
        "body": {
          "id": "fake-msg-1",
          "type": "message",
          "role": "assistant",
          "content": [
            {
              "type": "text",
              "text": "only"
            }
          ],
          "stop_reason": "end_turn",
          "usage": {
            "input_tokens": 100,
            "output_tokens": 50,
            "cache_read_input_tokens": 0,
            "cache_creation_input_tokens": 0
          }
        }
      }
    }
  ]
}
