{
  "$schema": "../../schema/case.schema.json",
  "name": "overlap-group",
  "description": "Three parallel steps marked overlap form one group: a sub-call of the first plan arrives before the second plan, and the merge step after the group is not reachable until every step in the group is used. The group's sections are used up separately.",
  "scenario": {
    "name": "nested",
    "steps": [
      {
        "parallel": {
          "overlap": true,
          "steps": [
            {
              "match": {
                "lastUser": {
                  "equals": "plan a"
                }
              },
              "text": "A"
            },
            {
              "match": {
                "lastUser": {
                  "equals": "plan b"
                }
              },
              "text": "B"
            }
          ]
        }
      },
      {
        "parallel": {
          "overlap": true,
          "steps": [
            {
              "match": {
                "lastUser": {
                  "equals": "a1"
                }
              },
              "text": "A1"
            },
            {
              "match": {
                "lastUser": {
                  "equals": "a2"
                }
              },
              "text": "A2"
            }
          ]
        }
      },
      {
        "parallel": {
          "overlap": true,
          "steps": [
            {
              "match": {
                "lastUser": {
                  "equals": "b1"
                }
              },
              "text": "B1"
            }
          ]
        }
      },
      {
        "match": {
          "lastUser": {
            "equals": "merge"
          }
        },
        "text": "merged"
      }
    ]
  },
  "exchanges": [
    {
      "request": {
        "method": "POST",
        "path": "/anthropic/v1/messages",
        "headers": {
          "content-type": "application/json"
        },
        "body": {
          "model": "example-model",
          "max_tokens": 64,
          "messages": [
            {
              "role": "user",
              "content": "plan a"
            }
          ]
        }
      },
      "response": {
        "status": 200,
        "headers": {
          "content-type": "application/json"
        },
        "body": {
          "id": "fake-msg-1",
          "type": "message",
          "role": "assistant",
          "model": "example-model",
          "content": [
            {
              "type": "text",
              "text": "A"
            }
          ],
          "stop_reason": "end_turn",
          "stop_sequence": null,
          "usage": {
            "input_tokens": 100,
            "output_tokens": 50,
            "cache_read_input_tokens": 0,
            "cache_creation_input_tokens": 0
          }
        }
      }
    },
    {
      "request": {
        "method": "POST",
        "path": "/anthropic/v1/messages",
        "headers": {
          "content-type": "application/json"
        },
        "body": {
          "model": "example-model",
          "max_tokens": 64,
          "messages": [
            {
              "role": "user",
              "content": "a1"
            }
          ]
        }
      },
      "response": {
        "status": 200,
        "headers": {
          "content-type": "application/json"
        },
        "body": {
          "id": "fake-msg-2",
          "type": "message",
          "role": "assistant",
          "model": "example-model",
          "content": [
            {
              "type": "text",
              "text": "A1"
            }
          ],
          "stop_reason": "end_turn",
          "stop_sequence": null,
          "usage": {
            "input_tokens": 100,
            "output_tokens": 50,
            "cache_read_input_tokens": 0,
            "cache_creation_input_tokens": 0
          }
        }
      }
    },
    {
      "request": {
        "method": "POST",
        "path": "/anthropic/v1/messages",
        "headers": {
          "content-type": "application/json"
        },
        "body": {
          "model": "example-model",
          "max_tokens": 64,
          "messages": [
            {
              "role": "user",
              "content": "plan b"
            }
          ]
        }
      },
      "response": {
        "status": 200,
        "headers": {
          "content-type": "application/json"
        },
        "body": {
          "id": "fake-msg-3",
          "type": "message",
          "role": "assistant",
          "model": "example-model",
          "content": [
            {
              "type": "text",
              "text": "B"
            }
          ],
          "stop_reason": "end_turn",
          "stop_sequence": null,
          "usage": {
            "input_tokens": 100,
            "output_tokens": 50,
            "cache_read_input_tokens": 0,
            "cache_creation_input_tokens": 0
          }
        }
      }
    },
    {
      "request": {
        "method": "POST",
        "path": "/anthropic/v1/messages",
        "headers": {
          "content-type": "application/json"
        },
        "body": {
          "model": "example-model",
          "max_tokens": 64,
          "messages": [
            {
              "role": "user",
              "content": "merge"
            }
          ]
        }
      },
      "response": {
        "status": 400,
        "headers": {
          "content-type": "application/json"
        },
        "body": {
          "fake_llm_error": "no-match",
          "message": {
            "$type": "string"
          },
          "seq": 4,
          "vendor": "anthropic",
          "model": "example-model",
          "system_shape": "absent",
          "message_count": 1,
          "prompt_preview": "merge\n"
        }
      }
    },
    {
      "request": {
        "method": "POST",
        "path": "/anthropic/v1/messages",
        "headers": {
          "content-type": "application/json"
        },
        "body": {
          "model": "example-model",
          "max_tokens": 64,
          "messages": [
            {
              "role": "user",
              "content": "b1"
            }
          ]
        }
      },
      "response": {
        "status": 200,
        "headers": {
          "content-type": "application/json"
        },
        "body": {
          "id": "fake-msg-5",
          "type": "message",
          "role": "assistant",
          "model": "example-model",
          "content": [
            {
              "type": "text",
              "text": "B1"
            }
          ],
          "stop_reason": "end_turn",
          "stop_sequence": null,
          "usage": {
            "input_tokens": 100,
            "output_tokens": 50,
            "cache_read_input_tokens": 0,
            "cache_creation_input_tokens": 0
          }
        }
      }
    },
    {
      "request": {
        "method": "GET",
        "path": "/health"
      },
      "response": {
        "status": 200,
        "headers": {
          "content-type": "application/json"
        },
        "body": {
          "status": "ok",
          "scenario": "nested",
          "lenient": false,
          "steps": 4,
          "unusedSteps": [
            2,
            4
          ],
          "version": {
            "$type": "string"
          }
        }
      }
    },
    {
      "request": {
        "method": "POST",
        "path": "/anthropic/v1/messages",
        "headers": {
          "content-type": "application/json"
        },
        "body": {
          "model": "example-model",
          "max_tokens": 64,
          "messages": [
            {
              "role": "user",
              "content": "a2"
            }
          ]
        }
      },
      "response": {
        "status": 200,
        "headers": {
          "content-type": "application/json"
        },
        "body": {
          "id": "fake-msg-6",
          "type": "message",
          "role": "assistant",
          "model": "example-model",
          "content": [
            {
              "type": "text",
              "text": "A2"
            }
          ],
          "stop_reason": "end_turn",
          "stop_sequence": null,
          "usage": {
            "input_tokens": 100,
            "output_tokens": 50,
            "cache_read_input_tokens": 0,
            "cache_creation_input_tokens": 0
          }
        }
      }
    },
    {
      "request": {
        "method": "POST",
        "path": "/anthropic/v1/messages",
        "headers": {
          "content-type": "application/json"
        },
        "body": {
          "model": "example-model",
          "max_tokens": 64,
          "messages": [
            {
              "role": "user",
              "content": "merge"
            }
          ]
        }
      },
      "response": {
        "status": 200,
        "headers": {
          "content-type": "application/json"
        },
        "body": {
          "id": "fake-msg-7",
          "type": "message",
          "role": "assistant",
          "model": "example-model",
          "content": [
            {
              "type": "text",
              "text": "merged"
            }
          ],
          "stop_reason": "end_turn",
          "stop_sequence": null,
          "usage": {
            "input_tokens": 100,
            "output_tokens": 50,
            "cache_read_input_tokens": 0,
            "cache_creation_input_tokens": 0
          }
        }
      }
    }
  ]
}
