{
  "$schema": "../../schema/case.schema.json",
  "name": "usage-openai-stream-include-usage",
  "description": "With stream_options.include_usage, the usage chunk reports the step's prompt, completion and total tokens.",
  "scenario": {
    "name": "stream-include-usage",
    "steps": [
      {
        "text": "Hi.",
        "usage": {
          "inputTokens": 1200,
          "outputTokens": 340
        }
      }
    ]
  },
  "exchanges": [
    {
      "request": {
        "method": "POST",
        "path": "/openai/v1/chat/completions",
        "headers": {
          "content-type": "application/json"
        },
        "body": {
          "model": "example-gpt",
          "messages": [
            {
              "role": "user",
              "content": "Hello"
            }
          ],
          "stream": true,
          "stream_options": {
            "include_usage": true
          }
        }
      },
      "response": {
        "status": 200,
        "headers": {
          "content-type": "text/event-stream"
        },
        "events": [
          {
            "event": "message",
            "data": {
              "id": "fake-openai-1",
              "object": "chat.completion.chunk",
              "model": "fake-openai",
              "choices": [
                {
                  "index": 0,
                  "delta": {
                    "role": "assistant",
                    "content": ""
                  },
                  "finish_reason": null
                }
              ],
              "usage": null
            }
          },
          {
            "event": "message",
            "data": {
              "id": "fake-openai-1",
              "object": "chat.completion.chunk",
              "model": "fake-openai",
              "choices": [
                {
                  "index": 0,
                  "delta": {
                    "content": "Hi."
                  },
                  "finish_reason": null
                }
              ],
              "usage": null
            }
          },
          {
            "event": "message",
            "data": {
              "id": "fake-openai-1",
              "object": "chat.completion.chunk",
              "model": "fake-openai",
              "choices": [
                {
                  "index": 0,
                  "delta": {},
                  "finish_reason": "stop"
                }
              ],
              "usage": null
            }
          },
          {
            "event": "message",
            "data": {
              "id": "fake-openai-1",
              "object": "chat.completion.chunk",
              "model": "fake-openai",
              "choices": [],
              "usage": {
                "prompt_tokens": 1200,
                "completion_tokens": 340,
                "total_tokens": 1540
              }
            }
          },
          {
            "event": "message",
            "data": "[DONE]"
          }
        ]
      }
    }
  ]
}
