{
  "$schema": "../../schema/case.schema.json",
  "name": "responses-thinking-tool-only",
  "description": "Thinking with tool calls and no text: output is the reasoning item, then the function_call items.",
  "scenario": {
    "name": "responses-thinking-tool-only",
    "steps": [
      {
        "thinking": "Need the weather.",
        "toolCalls": [
          {
            "name": "get_weather",
            "arguments": {
              "city": "Paris"
            }
          }
        ]
      }
    ]
  },
  "exchanges": [
    {
      "request": {
        "method": "POST",
        "path": "/openai/v1/responses",
        "headers": {
          "content-type": "application/json"
        },
        "body": {
          "model": "example-gpt",
          "input": "Hello"
        }
      },
      "response": {
        "status": 200,
        "headers": {
          "content-type": "application/json"
        },
        "body": {
          "id": "resp_fake_1",
          "object": "response",
          "status": "completed",
          "error": null,
          "incomplete_details": null,
          "model": "example-gpt",
          "output": [
            {
              "id": "rs_fake_1",
              "type": "reasoning",
              "summary": [
                {
                  "type": "summary_text",
                  "text": "Need the weather."
                }
              ]
            },
            {
              "id": "fc_fake_1_1",
              "type": "function_call",
              "status": "completed",
              "call_id": "call_fake_1_1",
              "name": "get_weather",
              "arguments": "{\"city\":\"Paris\"}"
            }
          ],
          "parallel_tool_calls": true,
          "tool_choice": "auto",
          "tools": [],
          "usage": {
            "input_tokens": 100,
            "input_tokens_details": {
              "cached_tokens": 0
            },
            "output_tokens": 50,
            "output_tokens_details": {
              "reasoning_tokens": 0
            },
            "total_tokens": 150
          }
        }
      }
    },
    {
      "request": {
        "method": "GET",
        "path": "/control/calls"
      },
      "response": {
        "status": 200,
        "headers": {
          "content-type": "application/json"
        },
        "body": [
          {
            "seq": 1,
            "vendor": "openai-responses",
            "model": "example-gpt",
            "systemShape": "absent",
            "messageCount": 1,
            "outcome": "tool-calls",
            "timestampMs": {
              "$type": "integer"
            },
            "promptSample": "Hello\n",
            "step": 1,
            "toolCalls": [
              {
                "id": "call_fake_1_1",
                "name": "get_weather"
              }
            ],
            "toolResults": [],
            "firstByteDelayMs": 0,
            "streamInterChunkDelayMs": 0
          }
        ]
      }
    }
  ]
}
