{
  "$schema": "../../schema/case.schema.json",
  "name": "health-unused-steps",
  "description": "GET /health reports the loaded scenario's step count and the steps no call has used: all three after the load, the tail as calls use them, none once every step has served a call or after a call past the last step, all three again after a reset, and none after an unload.",
  "scenario": {
    "name": "three-steps",
    "steps": [
      {
        "text": "first"
      },
      {
        "text": "second"
      },
      {
        "text": "third"
      }
    ]
  },
  "exchanges": [
    {
      "request": {
        "method": "GET",
        "path": "/health"
      },
      "response": {
        "status": 200,
        "headers": {
          "content-type": "application/json"
        },
        "body": {
          "status": "ok",
          "scenario": "three-steps",
          "lenient": false,
          "steps": 3,
          "unusedSteps": [
            1,
            2,
            3
          ],
          "version": {
            "$type": "string"
          }
        }
      }
    },
    {
      "request": {
        "method": "POST",
        "path": "/openai/v1/chat/completions",
        "headers": {
          "content-type": "application/json"
        },
        "body": {
          "model": "example-gpt",
          "messages": [
            {
              "role": "user",
              "content": "One"
            }
          ]
        }
      },
      "response": {
        "status": 200,
        "headers": {
          "content-type": "application/json"
        },
        "body": {
          "id": "fake-openai-1",
          "object": "chat.completion",
          "model": "example-gpt",
          "choices": [
            {
              "index": 0,
              "message": {
                "role": "assistant",
                "content": "first"
              },
              "finish_reason": "stop"
            }
          ],
          "usage": {
            "prompt_tokens": 100,
            "completion_tokens": 50,
            "total_tokens": 150
          }
        }
      }
    },
    {
      "request": {
        "method": "GET",
        "path": "/health"
      },
      "response": {
        "status": 200,
        "headers": {
          "content-type": "application/json"
        },
        "body": {
          "status": "ok",
          "scenario": "three-steps",
          "lenient": false,
          "steps": 3,
          "unusedSteps": [
            2,
            3
          ],
          "version": {
            "$type": "string"
          }
        }
      }
    },
    {
      "request": {
        "method": "POST",
        "path": "/openai/v1/chat/completions",
        "headers": {
          "content-type": "application/json"
        },
        "body": {
          "model": "example-gpt",
          "messages": [
            {
              "role": "user",
              "content": "Two"
            }
          ]
        }
      },
      "response": {
        "status": 200,
        "headers": {
          "content-type": "application/json"
        },
        "body": {
          "id": "fake-openai-2",
          "object": "chat.completion",
          "model": "example-gpt",
          "choices": [
            {
              "index": 0,
              "message": {
                "role": "assistant",
                "content": "second"
              },
              "finish_reason": "stop"
            }
          ],
          "usage": {
            "prompt_tokens": 100,
            "completion_tokens": 50,
            "total_tokens": 150
          }
        }
      }
    },
    {
      "request": {
        "method": "POST",
        "path": "/openai/v1/chat/completions",
        "headers": {
          "content-type": "application/json"
        },
        "body": {
          "model": "example-gpt",
          "messages": [
            {
              "role": "user",
              "content": "Three"
            }
          ]
        }
      },
      "response": {
        "status": 200,
        "headers": {
          "content-type": "application/json"
        },
        "body": {
          "id": "fake-openai-3",
          "object": "chat.completion",
          "model": "example-gpt",
          "choices": [
            {
              "index": 0,
              "message": {
                "role": "assistant",
                "content": "third"
              },
              "finish_reason": "stop"
            }
          ],
          "usage": {
            "prompt_tokens": 100,
            "completion_tokens": 50,
            "total_tokens": 150
          }
        }
      }
    },
    {
      "request": {
        "method": "GET",
        "path": "/health"
      },
      "response": {
        "status": 200,
        "headers": {
          "content-type": "application/json"
        },
        "body": {
          "status": "ok",
          "scenario": "three-steps",
          "lenient": false,
          "steps": 3,
          "unusedSteps": [],
          "version": {
            "$type": "string"
          }
        }
      }
    },
    {
      "request": {
        "method": "POST",
        "path": "/openai/v1/chat/completions",
        "headers": {
          "content-type": "application/json"
        },
        "body": {
          "model": "example-gpt",
          "messages": [
            {
              "role": "user",
              "content": "Four"
            }
          ]
        }
      },
      "response": {
        "status": 400,
        "headers": {
          "content-type": "application/json"
        },
        "body": {
          "fake_llm_error": "no-more-steps",
          "message": {
            "$type": "string"
          },
          "scenario": "three-steps",
          "steps": 3,
          "seq": 4,
          "vendor": "openai",
          "model": "example-gpt",
          "system_shape": "absent",
          "message_count": 1,
          "prompt_preview": "Four\n"
        }
      }
    },
    {
      "request": {
        "method": "GET",
        "path": "/health"
      },
      "response": {
        "status": 200,
        "headers": {
          "content-type": "application/json"
        },
        "body": {
          "status": "ok",
          "scenario": "three-steps",
          "lenient": false,
          "steps": 3,
          "unusedSteps": [],
          "version": {
            "$type": "string"
          }
        }
      }
    },
    {
      "request": {
        "method": "POST",
        "path": "/control/reset",
        "headers": {}
      },
      "response": {
        "status": 200,
        "headers": {
          "content-type": "application/json"
        },
        "body": {
          "reset": true
        }
      }
    },
    {
      "request": {
        "method": "GET",
        "path": "/health"
      },
      "response": {
        "status": 200,
        "headers": {
          "content-type": "application/json"
        },
        "body": {
          "status": "ok",
          "scenario": "three-steps",
          "lenient": false,
          "steps": 3,
          "unusedSteps": [
            1,
            2,
            3
          ],
          "version": {
            "$type": "string"
          }
        }
      }
    },
    {
      "request": {
        "method": "POST",
        "path": "/control/unload",
        "headers": {}
      },
      "response": {
        "status": 200,
        "headers": {
          "content-type": "application/json"
        },
        "body": {
          "unloaded": true
        }
      }
    },
    {
      "request": {
        "method": "GET",
        "path": "/health"
      },
      "response": {
        "status": 200,
        "headers": {
          "content-type": "application/json"
        },
        "body": {
          "status": "ok",
          "scenario": null,
          "lenient": false,
          "steps": null,
          "unusedSteps": [],
          "version": {
            "$type": "string"
          }
        }
      }
    }
  ]
}
